COURSE_SUBJECT,COURSE_NUMBER,COURSE_TITLE,RESOURCE_NAME,ISBN
COUN PSY,926,Ethical & Professional Issues,Ethics in psychotherapy and counseling,1119195443
DS,222,Interior Design I,NKBA Kitchen and Bathroom Planning Guidelines with Access Standards,1119216001
ED PSYCH,570,Found of Ed Measurement,Educational Testing and Measurement,1119229346
ELPA,841,Legal Aspects of Higher Ed,"The Law of Higher Education, 6th Edition: Student Version",1119271918
G L E,537,Quantitative Methods,MATLAB: An Introduction with Applications,1119299257
DS,222,Interior Design I,The Codes Guidebook for Interiors,1119343196
ELPA,961,Critical Issues in Ed Policy,Empowered Educators,1119369608
B M E,462,Medical Instrumentation,Medical Instrumentation: Application and Design,1119457336
COUN PSY,800,Theories of Counseling,Counseling and Psychotherapy Theories in Context and Practice:3rd Edition,1119473312
M E,424,Stat Expermntl Design,Design and Analysis of Experiments,1119492443
ACCT I S,100,Intro Financial Accounting,Financial Accounting (WileyPLUS Next Generation Code and Loose-leaf print book),1119493648
ACCT I S,100,Intro Financial Accounting,Financial Accounting WileyPLUS Next Generation Code (Standalone),1119493679
ACCT I S,211,Intro Managerial Accounting,Managerial Accounting - Tools For Business Decision Making,1119498728
ACCT I S,302,Financial Reporting II,Intermediate Accounting,1119503682
DY SCI,535,Dairy Farm Mgmt Practicum,Bullet Proof Problem Solving,1119553021
E P D,629,Powertrain Systems & Controls,Control Systems Engineering,1119590132
PSYCH,720,Cognitive Neuroscience,Essentials of Cognitive Neuroscience,9781119607
ELPA,827,Surveys/Quant Data Collection,"Internet, Phone, Mail, and Mixed-Mode Surveys: The Tailored Design Method, 4th Edition",1119622895
ACCT I S,301,Financial Reporting I,Intermediate Accounting (see options below),1119632290
L I S,706,Data Mining Planning and Mgmt,"Predictive Analytics, Data Mining and Big Data: Myths, Misconceptions and Methods",1137379276
ECON,455,Behavioral Economics,Behavioral Economics,1138097124
CURRIC,240,"Crit Aspects Teach, Schl, Educ",Education and Racism: A Primer,1138118775
ELPA,736,Admin Stdt Serv-Higher Educ,Helping Skills for Working with College Students,1138122376
ECON,548,Economics of Health Care,Health Economics,1138207981
PUB AFFR,380,Tools for Public Policy,Policy Analysis: Concepts and Practice,1138216518
CNSR SCI,561,Retail Channel Strategy,"Experiential Marketing Consumer Behavior, Customer Experience and The 7Es",1138293151
HISTORY,201,The Historian's Craft,The Witchcraft Reader,1138565425
LSC,720,Intro-Communication Thry&Rsch,Media Effects: Advances in Theory and Research,1138590229
ELPA,961,Critical Issues in Ed Policy,New Imperatives of Educational Change,1138926936
COM ARTS,351,Television Industries,From Networks to Netflix: A Guide to Changing Channels,1138998513
ECON,390,Contemporary Economic Issues,Factfulness,1250123824
ASIAN AM,240,Topics-Asian Amer Studies,Number One Chinese Restaurant. A Novel,1250141293
ENGL,814,Topics in Contemporary Lit,Severance,1250214997
E P D,612,Technical Project Management,Project Management: The Managerial Process,1259666094
I SY E,315,Production Planning&Control,OPERATIONS & SUPPLY CHAIN MANAGEMENT,1259666100
CNSR SCI,562,The Global Consumer,International Marketing,1259712357
STAT,371,Intro Applied Stats-Life Sci,Statistics for Engineers and Scientists 5th Edition,1259717604
E P D,613,Intl Engr Strategies&Operatns,"International Management - Culture, Strategy and Behavior",1259921926
KINES,566,Promoting Community Health,Health Education: Elementary and Middle School Applications,1259922381
KINES,370,"Pln, Fac, Assess Mvmt & Hlth",Teaching Physical Education for Learning,1259922411
COM ARTS,181,Elements of Speech-Honors,eBook version of The Art of Public Speaking,1259924606
FINANCE,320,Investment Theory,Investments,1260013832
M H R,610,Compensation: Theory & Adm,Compensation (see website information below to purchase),1260043723
COM ARTS,350,Introduction to Film,Film Art: An Introduction,1260056082
PHM PRAC,551,Clinical Pharmacokinetics,Pharmacotherapy: A pathophysiologic Approach,1260116816
ANAT&PHY,335,Physiology,Vander's Human Physiology,1260231571
M H R,705,Human Resource Management,Human Resource Management,1260262575
NUTR SCI,132,Nutrition Today,Nutrition: Ecology and Behavior,1260361100
COM ARTS,100,Intro to Speech Composition,"Connect Access Card for The Art of Public Speaking,",1260412888
NURSING,704,Ldrshp in Adv Practc Nursing I,Advanced Practice Nursing: Essential Knowledge for the Profession,1284072570
NUTR SCI,525,"Nutrition, Fitness and Health",Practical Applications in Sports Nutrition,1284101393
NUTR SCI,653,Clinical Nutrition Research,Nutrition Research Concepts and Applications,1284101539
PUBLHLTH,783,Quantitative Approaches to PH,Essentials of Biotatistics in Public Health,1284108194
OCC THER,811,Appld Leadshp & Mangmnt in OT,"Leadership for Health Professionals: Theory, Skills, and Applications",1284109412
PUBLHLTH,783,Quantitative Approaches to PH,Essentials of Epidemiology in Public Health,1284128352
NUTR SCI,651,Adv Clin Nutrition Pediatrics,Samour & King's Pediatric Nutrition in Clinical Care,1284146394
S&A PHM,411,Pharmacy and Health System,McCarthy's Introduction to Health Care Delivery: A Primer for Pharmacists,1284564426
ITALIAN,204,Fourth Semester Italian,Ponti (Hard Cover),1285041902
CHEM,104,General Chemistry II,A subscription to OWLv2 for Chemistry: The Molecular Science,1285460369
FRENCH,204,Fourth Semester French,Sur le Vif (bundle: ISBN 978-1285-72260-3,1285722603
SPANISH,325,Advanced Conversation,Conversaciones creadoras,1285733845
SOC WORK,721,Methods-Planning Analysis,Applied Statistics for Public and Nonprofit Administration (9th Edition),1285737232
MICROBIO,303,Biology of Microorganisms,Through the Microscope,1304788573
MATH,211,Calculus,***See special instructions***,1305085312
RP & SE,501,Rehab-Cnslg Psych: Applcatn,The Human Services Internship: Getting the Most from Your Experience,1305087347
SOC WORK,640,Diversity Opp Soc Just in SW,"Race, Class, and Gender: An Anthology",1305093614
STAT,311,"Intro Math Stat (Theo, Meth) I",PROBABILITY AND STATISTICS for Engineers and the Sciences,1305251809
RP & SE,500,Rehab-Cnslg Psych: Foundatn,"Theory, Practice, and Trends in Human Services: An Introduction (6th Edition)",1305271494
SOC WORK,835,Adv Soc Work Pract-Mental Hlth,Interpersonal Process in Therapy: An integrative Model,1305271531
STAT,371,Intro Applied Stats-Life Sci,An Introduction to Statistical Methods and Data Analysis,1305465527
RP & SE,464,Diagnosis and Assessment,Assessment in Special and Inclusive Education,1305642355
NUTR SCI,641,App Clinical Nutrition I,Medical Nutrition Therapy. A case Study Approach,1305875357
LSC,314,Intro to Digital Video Prod,Video Basics (8th Edition),1305950863
M H R,434,Venture Creation,New Venture Creation -Fall 2020,1307623796
C&E SOC,360,Stats for Sociologists I,The Basic Practice of Statistics,1319042578
HISTORY,261,American Legal History to 1860,Dred Scott v. Sandford: A Brief History with Documents,1319048983
ECON,464,International Trade,International Trade,9781319061
ECON,461,International Macroeconomics,International Macroeconomics,1319061722
HISTORY,201,The Historian's Craft,The Salem Witch  Hunt: A Brief History with Documents,1319088132
CHEM,343,Intro Organic Chemistry,Organic Chemistry Custom Bundle (text and solutions manual),1319100704
AMER IND,100,Intro-Amer Indian Studies,First Peoples: A Documentary Survey of American Indian History,1319104917
ECON,441,Analytical Public Finance,Public Finance and Public Policy,1319105280
HISTORY,600,Advanced Seminar in History,A Pocket Guide to Writing in History,1319113025
BIOLOGY,152,Introductory Biology,How Life Works,1319328634
ECON,102,Principles-Macroeconomics,"Principles of Macroeconomics, Loose-leaf Version",1337378994
ECON,410,Introductory Econometrics,Introductory Econometrics: A Modern Approach,1337558860
ACCT I S,630,Audit and Assurance Services,Auditing: A Risk-Based Approach,1337619455
INFO SYS,422,Computer-Based Data Mgt,"Database Systems: Design, Implementation, & Management",1337627900
MATH,112,Algebra,WebAssign for College Algebra,1337771870
ITALIAN,204,Fourth Semester Italian,Ponti (Looseleaf version),1337816878
MATH,319,Tech-Ordinary Diff Equation,WebAssign(with eBook) for Zill Differential equations with Boundary-Value Problems,1337879767
ENGL,458,Major American Writer(s),Ernest Hemingway: A Literary Life,1349520299
PSYCH,508,Human Emotions:Biology-Culture,Psychology of Emotion,1351995719
BSE,249,Engr Principles-Biol Systms,BSE 249: Engineering Principles for Biological Systems,1394047345
COM ARTS,612,Topics-Communicatn Science,The Immortal Life of Henrietta Lacks,1400052189
SLAVIC,245,Topics-Slavic Literatures,War and Peace. Translated by Richard Pevear and Larissa Volokhonsky,1400079988
G L E,801,Spec Topics-Geological Engr,Earthquake and Volcano Deformation,1400833856
ED PSYCH,326,"Mind, Brain and Education",The Learning Brain,1405124010
ENGL,315,English Phonology,Introductory Phonology,1405184113
ENGL,176,Topics in Literature and Film,A Midsummer Night's Dream,1408133491
CURRIC,318,Teaching Reading and Writing,Using the Language Experience approach with English Language Learners,1412955058
SOC WORK,949,Proseminar,Qualitative inquiry and research design: Choosing among five approaches (3rd Ed.).,1412995306
AFROAMER,156,Black Music&Am Cultrl Hist,The Rap Yearbook,1419718182
ASIAN AM,150,Lit & Culture of Asian America,The Best We Could Do,1419718786
SOIL SCI,622,Soil Physics,Soil Physics with HYDRUS: Modeling and Applications,1420073805
ELPA,887,Diversity and Inequality,"Degrees of Inequality Culture, Class, and Gender in American Higher Education",1421405742
ELPA,701,Intro-Higher & Post-Sec Ed,American Higher Education in the 21st Century,1421419909
SOC WORK,836,Mental Hlth Policies&Services,Committed: The Battle over Involuntary Psychiatric Care,1421420783
ELPA,701,Intro-Higher & Post-Sec Ed,A History of American Higher Education,1421428833
E C E,235,Intro-Solid State Electronics,Modern Physics,1429250788
GEOSCI,875,Advanced Topics in Geology,Earth's Climate: Past and Future,1429255257
GEOSCI,304,Geobiology,Earth System History,1429255264
NURSING,741,Adv Prac Nrsg Thry-Famly&Child,Theories of Developmental Psychology,1429278980
OCC THER,673,Sci Inq-OT III: Data Coll&Anal,Publication Manual of the American Psychological Association,1433805615
RP & SE,842,Legal Foundations of Spec Ed,Publication manual of the American Psychological Association,1433832161
RP & SE,501,Rehab-Cnslg Psych: Applcatn,Publication Manual of the American Psychological Association,1433832178
RP & SE,310,Positive Psych and Well Being,Flourish: A visionary new understanding of happiness and well-being,1439190760
NUTR SCI,650,Adv Clin Nutr: Crit Care Nutr,Nutrition Support for the Critically Ill Patient: A Guide to Practice,1439879993
M S & E,456,"Elec,Opt&Mag Prop of Materials",Electronic Properties of Materials,1441981646
ANTHRO,860,Hist-Anthropological Theory,"Anthropological Theory: An Introductory	History",1442257023
HISTORY,201,The Historian's Craft,The Bedevilment of Elizabeth Lorentz,1442634947
ANTHRO,860,Hist-Anthropological Theory,A History of Anthropological Theory,1442636835
ANTHRO,860,Hist-Anthropological Theory,"Readings for a History of Anthropological Theory, Fifth Edition",1442636873
GEOSCI,202,Intro to Geologic Structures,An Introduction to Geological Structures & Maps,1444112122
ELPA,502,Wkshp-Ed Leadership & Pol Anal,Administration of Intercollegiate Athletics,1450468152
KINES,330,Research in Kinesiology,Research Methods in Physical Activity,1450470445
PHM SCI,542,Parenteral Therapy & Nutrition,Pharmaceutical Calculations,1451120363
HISTORY,427,US Military History to 1902,For the Common Defense: A Military History of the United States from 1607 to 2012,1451623536
RELIG ST,305,"Women, Gender and Religion",Book of Mormon Girl,1451699685
SOC WORK,949,Proseminar,Qualitative methods in social work research (3rd Edition).,1452256702
E P D,611,Engr Economics & Management,Managerial Accounting (Purchase directly from publisher - see link below),1453375723
CNSR SCI,665,Household Risk Management,Risk Management for Individuals and Enterprises v2.0,1453392072
LAW,801,Evidence,AN ANALYTICAL APPROACH TO EVIDENCE,1454862987
LAW,817,Business Organizations I,Business Organizations,1454868361
LAW,711,Contracts I,Contracts: Cases and Doctrine,1454871033
LAW,828,International Transactions,"International Business Transactions: Problems, Cases, and Materials Documents Supplement",1454875666
LAW,714,Civil Procedure I,Civil Procedure:  A Coursebook (3rd Edition),1454881421
LAW,736,Secured Transactions,Problems and Materials on Secured Transactions,1454886068
LAW,850,Professnl Responsibilities,"Ethical Problems in the Practice of Law, Concise 4th edition",1454891284
CS&D,503,"Neurl Mech Speech,Hear&Lang",Nolte's the Human Brain,1455728596
HISTORY,130,Intro to World History,Islam in the Indian Ocean: A Brief History with Documents,1457609770
ECON,725,Machine Learning for Econ,Introduction to Statistical Learning,1461471387
ED PSYCH,840,Clinical Pract-School Psych,Clinical Interviews for Children and Adolescents: Assessment to Intervention,1462508419
SOC WORK,835,Adv Soc Work Pract-Mental Hlth,Clinical Handbook of Psychological Disorders,1462513260
NURSING,726,Foundations APN Clin Pract I,DSM 5 Made Easy: The clinician's guide to diagnosis,1462514427
CURRIC,368,The Teaching of Reading,Best Practices in Literacy Instruction,1462536771
M M & I,528,Immunology,Kuby Immunology 8th Edition,1464189784
HISTORY,861,Seminar-History of Africa,"Domingos Alvares, African Healing and the Intellectual History of the Atlantic World",9781469609
HISTORY,861,Seminar-History of Africa,"The Walking Qur?an: Islamic Education, Embodied Knowledge and History in West Africa",9781469614
AFROAMER,712,Educ and Civil Rights Movement,A Chance for Change: Head Start and Mississippi's Black Freedom Struggle,1469627809
HIST SCI,720,Historiography & Methods,Medicalizing Blackness,1469632872
CHICLA,153,Latina/Latino/Latinx History,They Should Stay There: The Story of Mexican Migration and Repatriation During the Great Depression,1469634265
AFROAMER,338,The Black Arts Movement,"Liberated Threads: Black Women, Style, and the Global Politics of Soul",1469636139
AFROAMER,338,The Black Arts Movement,: RemakingBlack Power: How Black Women Transformed an Era,1469654737
ART HIST,515,Proseminar in Medieval Art,Ashgate Research Companion to Monsters and the Monstrous,1472418012
L I S,622,Childrens Literature,The Bloomsbury Introduction to Children's and Young Adult Literature,1472575531
ASIAN AM,240,Topics-Asian Amer Studies,Food Studies A Hands-On Guide,1474298711
MATH,763,Intro to Algebraic Geometry,Algebraic Geometry,1475738490
AFROAMER,222,Intro-Black Women Writers,Redefining Realness,1476709130
ENGL,458,Major American Writer(s),A Farewell to Arms,1476764528
ENGL,350,Topics in Gender & Literature,Glitter Up the Dark: How Pop Music Broke the Binary,1477318782
HISTORY,861,Seminar-History of Africa,"At Penpoint: African Literatures, Postcolonial Studies and the Cold War",9781478009
ENGL,577,Postcolonial Theatre,The Trial of Dedan Kimathi,1478611318
HIST SCI,720,Historiography & Methods,Fugitive Science,1479847662
COM ARTS,359,Sports Media,Keywords for Media Studies,1479859610
FOOD SCI,410,Food Chemistry,Fennema's Food Chemistry,1482243611
ELPA,940,Topics Seminar-Educ Leadership,Mixed methods research: A guide to the field,1483306759
S&A PHM,702,Intro to Mixed Methods,Designing and Conducting Mixed Methods Research,1483344379
S&A PHM,702,Intro to Mixed Methods,A Concise Introduction to Mixed Methods Research,1483359045
ELPA,911,Authentic Pedagogy and Achieve,Authentic intellectual work: Improving teaching for rigorous learning,1483381084
STAT,240,Intro to Data Modeling I,R for Data Science,1491910399
L I S,646,Intro Info Architecture,Information Architecture: For the Web and Beyond,1491911686
L I S,646,Intro Info Architecture,"Learning Web Design: A Beginner's Guide to HTML, CSS, JavaScript, and Web Graphics",1491960202
KINES,547,Skills for Health,"The essentials of teaching: Health education curriculum, instruction and assessment.",1492508236
PHY THER,676,Musculoskeletal Dysfunction I,Orthopedic Joint Mobilization and Manipulation: An Evidenced-Based Approach,1492544951
KINES,112,Measuring Physical Act Beh,Foundations of Physical Activity and Public Health,1492589976
KINES,112,Measuring Physical Act Beh,Foundations of Physical Activity and Public Health ebook,1492592822
HISTORY,120,Europe&Mod World 1815-On,Darkness at Noon,1501161315
POLI SCI,401,Selected Topics-Poli Sci,The Professional Soldier: A Social and Political Portrait,1501179327
LEGAL ST,645,Intellectual Freedom,Copyright's Highway: The Law and Lore of Copyright from Gutenberg to the Celestial Jukebox,1503609228
RP & SE,719,Intro to Qualitative Research,Qualitative inquiry & research design. Choosing among five approaches.,1506330204
RP & SE,310,Positive Psych and Well Being,Positive Psychology: The Scientific and Practical Explorations of Human Strengths,1506357355
JOURN,658,Communication Rsch Methods,Investigating the Social World The Process and Practice of Research,1506361192
RP & SE,506,Strategy-Inclusive Schoolng,Joyful Learning: Active and Collaborative Learning Strategies for Inclusive Classrooms,1506375663
ELPA,886,Internationalization Higher Ed,"The Doha Experiment: Arab Kingdom, Catholic College, Jewish Teacher",1510721722
FRENCH,322,Intro to Lit of Modernity,Amphitryon 38,1512347005
SOC WORK,835,Adv Soc Work Pract-Mental Hlth,The Color of Hope: People of Color Mental Health Narratives,1514273487
CURRIC,240,"Crit Aspects Teach, Schl, Educ","Teaching, Schooling, and Education",1516549931
GEN&WS,720,Spec Topics-Gender&Wmn Studies,Matters of Care: Speculative Ethics in More Than Human Worlds,9781517900
CSCS,300,Nonprofit Sector: Overview,Living for Change:  Grace Lee Boggs An Autobiography,1517901486
GEN&WS,720,Spec Topics-Gender&Wmn Studies,Trans Care,9781517911
LAW,711,Contracts I,Contracts: Law in Action: Volume I,1522104049
LAW,711,Contracts I,Contracts: Law in Action: Volume I,1522104063
LAW,731,Constitutional Law I,Constitutional Law: a Context and Practice Casebook,1531004545
LAW,732,Real Estate Transactions I,"Understanding Modern Real Estate Transactions, Fourth Ed.",9781531006
LAW,723,Legal Research and Writing,A Lawyer Writes,1531008765
L I S,602,Info: Org and Search,Online searching: a guide to finding quality information efficiently and effectively.,1538115077
L I S,602,Info: Org and Search,Online searching: A guide to finding quality information efficiently and effectively,1538115084
POLI SCI,408,The American Presidency,Presidential Leadership: Politics and Policy Making,1538136089
POLI SCI,511,Campaign Finance,Game Changers,1538136188
ENGL,245,Seminar in the Major,Parable of the Sower,1538732182
SCAND ST,201,Second Year Norwegian,Sett i Gang II  textbook   Edition II,1540745712
FRENCH,203,Third Semester French,Portails 2,1543304466
LAW,828,International Transactions,International Business Transactions:  Problems Cases and Materials,1543801040
CNSR SCI,562,The Global Consumer,Consumer Behavior & Culture: Consequences for Global Marketing and Advertising,1544318158
POLI SCI,305,Elections & Voting Behavior,Change and Continuity in the 2016 and 2018 Elections,1544356747
POLI SCI,305,Elections & Voting Behavior,Change and Continuity in the 2016 and 2018 Elections,1544356778
POLI SCI,359,American Foreign Policy,The Politics of United States Foreign Policy,1544374550
JOURN,618,Mass Comm & Political Behav,"Mediated Democracy: Politics, the News and Citizenship in the 21st Century",1544379159
ENGL,176,Topics in Literature and Film,The Time Machine,1551113050
GEN&WS,720,Spec Topics-Gender&Wmn Studies,Care Work: Dreaming Disability Justice,1551527383
ENVIR ST,126,Principles-Envrnmtl Science,How Bad Are Bananas?: The Carbon Footprint of Everything,1553658313
MICROBIO,470,Micro Genetics & Mol Machines,Molecular Genetics of Bacteria,1555816278
ENGL,174,Literature and Social Justice,Citizen,1555976903
ENGL,814,Topics in Contemporary Lit,Oculus,1555978259
ENGL,814,Topics in Contemporary Lit,Be Recorder,1555978488
SOC,674,Demographic Techniques I,Demography: Measuring and Modelling Population Processes,1557864512
CHICLA,330,Topics in Chicano/a Studies,...And the Earth Did Not Devour Him,1558850835
AFROAMER,225,Intro-AfricanAmer Dramatic Lit,Venus,1559361354
ENGL,577,Postcolonial Theatre,A Tempest,1559362103
AFROAMER,225,Intro-AfricanAmer Dramatic Lit,Intimate Apparel and  Fabulation,1559362795
AFROAMER,225,Intro-AfricanAmer Dramatic Lit,Radio Golf,1559363082
ASIAN,307,A Survey of Tibetan Buddhism,INTRODUCTION TO TIBETAN BUDDHISM,1559392822
E P D,518,Quality Engr & Quality Mgmnt,Change Basics,1562864521
RP & SE,842,Legal Foundations of Spec Ed,A guide to Special Education Law,1565341838
ENGL,822,Topics in Theory,Ornamental,1566895804
OCC THER,811,Appld Leadshp & Mangmnt in OT,Mentoring Leaders: the Power of Stroryteling for Building Leadership in Health Care and Education,1569003190
ASIAN,307,A Survey of Tibetan Buddhism,The Words Of My Perfect Teacher,1570624124
F&W ECOL,248,"Envir, Nat Resources & Society",Braiding Sweetgrass,1571313355
ENVIR ST,402,Soc Perspectives-Envir Studies,The Home Place (paperback edition),1571313508
E P D,636,Introduction to Polymers,Polymer Chemistry,1574447798
I SY E,515,Engr Mgt-Cont Proc Imprvmnt,The Memory Jogger 2: Tools for Continuous Improvement and Effective Planning,1576811139
AFROAMER,272,Race&Am Pol:New Deal-New Right,"Race, Reform and Rebellion: The Second Reconstruction and Beyond in Black America",1578061549
LAW,957,Intro to Estate Planning,Eckhardt's Workbook for Wisconsin Estate Planners,1578625475
ELPA,715,Govern&Admin-Coll&Universty,"Academic Leadership and Governance of Higher Education: a Guide for Trustees, Leaders, and Aspiring",1579224813
THEATRE,130,Fund of Theatrical Design,"Fundamentals of Theatrical Design: A Guide to the Basics of Scenic, Costume, and Lighting Design",1581158496
PHM PRAC,611,Medical Imaging for Pharmacist,Diagnostic Imaging for Pharmacists,1582121536
PHM PRAC,638,Nonprescrip Prod & Self-Care,"Handbook of Nonprescription Drugs, 19th edition",9781582122
ENGL,178,"Digital Media, Lit, Culture",Surveys,1584351788
KINES,116,First Aid & Basic Life Support,Responding to Emergencies: Comprehensive First Aid/CPR/AED,1584806844
AFRICAN,323,Third Semester Arabic,Alkitaab fi Tacallum al-cArabiyya Part One,1589017368
AFRICAN,323,Third Semester Arabic,Alkitaab fi Tacallum al-cArabiyya Part Two,1589019669
SPANISH,319,Topics in Span Lang Pract,En otras palabras. Perfeccionamiento del espa?ol por medio de la traduccion.,1589019744
ENGL,822,Topics in Theory,The Invention of Morel,1590170571
ENGL,176,Topics in Literature and Film,My Face for the World to See,1590176672
ED PSYCH,840,Clinical Pract-School Psych,Modular Cognitive-Behavioral Therapy for Childhood Anxiety Disorders,1593853631
ED PSYCH,840,Clinical Pract-School Psych,Helping Students Overcome Anxiety and Depression,1593856489
PL PATH,154,Antibiotic Discovery Research,Tiny Earth - A Research Guide to Studentsourcing Antibiotic Discovery,1593994938
ED PSYCH,542,Biological Basis of Behavior,Behave: The Biology of Humans at Our Best and Worst,1594205071
INTER-LS,210,L&S Career Development,CliftonStrengths for Students,1595621252
AFRICAN,391,1st Sem-Lang of West Africa,Wolof Lexicon and Grammar,1597030120
AFRICAN,391,1st Sem-Lang of West Africa,Nanu Degg Wolof: A Multilingual Approach to the Teaching and Learning of Wolof,1597030175
CS&D,863,Implantbl Auditory Prostheses,Cochlear Implants: Audiologic Management and Considerations for Implantable Hearing Devices,1597568920
CS&D,708,Fluency&Phonological Disorders,Clinical Decision Making in Fluency Disorders,1597569972
L I S,602,Info: Org and Search,The organization of information,1598848588
L I S,602,Info: Org and Search,The organization of information,1598848595
LAW,746,Legislation,Legislation and Statutory Interpretation (Concept & Insight Series),1599410784
LAW,746,Legislation,Statutory Interpretation (hardcover original),1599417707
F&W ECOL,401,Physiologicl Animal Ecology,Animal Physiology,1605354712
ENVIR ST,360,Extinction of Species,Conservation Biology,1605358826
RP & SE,980,Clin Reh Cnslg-Adv Assess Prac,Neuropsychology of everyday functioning,1606234594
RP & SE,980,Clin Reh Cnslg-Adv Assess Prac,"Clinician's Thesaurus, 7th Edition: The Guide to Conducting Interviews and Writing Psychological Rep",1606238745
ENGL,156,Literature and Medicine,The Spectral Wilderness,1606352113
COM ARTS,351,Television Industries,Portals: A Treatise on Internet-Distributed Television,1607854005
AFROAMER,712,Educ and Civil Rights Movement,From #Black Lives Matter to Black Liberation,1608465620
POLI SCI,272,Intro to Public Policy,A Practical Guide for Policy Analysis,1608718429
SOC WORK,821,SW Pract. in Aging & MH,Mental Disorders in Older Adults: Fundamentals of assessment and treatment,1609182328
LAW,918,Problems: Intl Law Seminar,International Environmental Law and Policy,1609303211
LAW,822,Family Law: Marriage & Divorce,Family Law: Cases and Materials,1609304102
E P D,613,Intl Engr Strategies&Operatns,The Culture Map: breaking through the invisible boundaries of global business,1610392501
GEN BUS,320,Intercultural Communctn in Bus,"The Culture Map: Decoding How People Think, Lead and Get Things Done Across Cultures",1610392761
SLAVIC,245,Topics-Slavic Literatures,Nothing is True and Everything is Possible : the Surreal Heart of the New Russia,1610396004
HORT,234,Ornamental Plants,Herbaceous Perennial Plants,1610583800
M S & E,260,Materials Experience,Substance of Civilization Materials and Human History from the Stone Age to the Age of Silicon,1611454017
