COURSE_SUBJECT,COURSE_NUMBER,COURSE_TITLE,RESOURCE_NAME,ISBN
CIV ENGR,723,Energy Principles of Env Eng,Introduction to Thermodynamics and Heat Transfer,0073380179
E M A,201,Statics,Engineering Mechanics: Statics,0073380292
SPANISH,224,Intro-Hispanic Literatures,Aproximaciones al estudio de la literatura hispanica,0073385372
I SY E,313,Engineerng Economc Analysis,Engineering Economy,0073523439
E P D,518,Quality Engr & Quality Mgmnt,Kaizen,0075543329
E M A,202,Dynamics,Dynamics,0077891145
REAL EST,420,Urban & Regional Economics,URBAN ECONOMICS,0078021787
RP & SE,660,Special Topics,Applied Sport Psychology,0078022708
FINANCE,330,Derivative Securities,Derivatives: Principles and Practice,0078034732
ZOOLOGY,603,Endocrinology,Hormones,0080919065
CBE,450,Process Design,"Chemical Engineering Design, Principles, Practice and Economics of Plant and Process Design",0080966601
CHEM,636,Topics-Chem Instrumentatn: NMR,High Resolution NMR Spectroscopy in Organic Chemistry,0080999869
MATH,570,Fundamentals of Set Theory,Elements of set theory,0122384400
PHYSICS,109,Physics in the Arts,Physics in the Arts,0123918789
SOC WORK,835,Adv Soc Work Pract-Mental Hlth,Treatment lanning for Person-Centered Care: Shared Decision Making for Whole Health,0123944481
FOOD SCI,440,Principles of Food Engr,Introduction to Food Engineering,0123985309
COMP SCI,552,Intro-Computer Architecture,Computer Organization and Design: The Hardware and Software Interface,0124077263
SOIL SCI,321,Soils and Environmental Chem,Soil & Environmental Chemistry,0128041789
CIV ENGR,494,Civ&Envr Engr Decisn Making,Civil and Environmental Systems Engineering,0130478221
COMP SCI,537,Intro to Operating Systems,The C Programming Language,0131103627
CIV ENGR,576,Advanced Pavement Design,Pavement Analysis and Design,0131424739
E C E,431,Digital Signal Processing,Discrete-Time Signal Processing,0131988422
SLAVIC,203,Third Semester Russian,V PUTI& STUDT ACTIV MANL&REF GRAMR&OXFD DIC,0132231299
MATH,340,Elem Matrix&Linear Algebra,Elementary Linear Algebra with Applications,0132296540
ESL,345,American English Pronunciation,Focus on Pronunciation 3,0132315005
E C E,447,Applied Communications Sys,Microwave Transistor Amplifiers: Analysis and Design,0132543354
CS&D,708,Fluency&Phonological Disorders,Children's Speech: An evidence-based approach to assessment and intervention,0132756198
DS,222,Interior Design I,Beginnings of Interior Environments,0132786003
E C E,220,Electrodynamics I,Fundamentals of Applied Electromagnetics,0133356816
ECON,400,Intro Applied Econometrics,Introduction to Econometrics,0133486872
FOOD SCI,437,Food Service Operations,Foodservice Management: principles and practices,0133762754
ECON,301,Intmed Microeconomic Theory,Microeconomics (My Lab Economics with Pearson eText/Access Card Package),0134143071
ACCT I S,770,Smr:Financial Reporting Theory,Financial Accounting Theory,0134166681
CS&D,315,Phonetics and Phon. Dvlpt.,Articulation and Phonological Disorders: Speech Sound Disorders in Children,0134170718
ESL,343,Oral Communication Skills,Contemporary Topics 3,0134400792
HDFS,501,Special Topics,Infant and Toddler Development and Responsive Program Planning:  A Relationship-Based Approach,0134450094
RP & SE,820,Clin Rehab Cnslg-Cnslg Theory,"Theories of Counseling and Psychotherapy: Systems, Strategies, and Skills",0134460864
MATH,320,Linear Alg & Diff Equations,Differential Equations and Linear Algebra,0134497181
PUB AFFR,880,Microecon Policy Analysis,Microeconomics,0134519531
SOC WORK,605,The Field of Social Work,"The Social Work Experience, 7th Edition",0134544953
ECON,301,Intmed Microeconomic Theory,Microeconomics (Student Value Edition plus My Lab Economics with Pearson eText/Access Card Package),0134643175
ECON,301,Intmed Microeconomic Theory,Microeconomics (Hardcover with My Lab Economics with Pearson eText/Access Card Package),0134674551
M E,446,Automatic Controls,Feedback Control of Dynamic Systems,0134685717
PSYCH,456,Intro-Social Psychology,Social Psychology 10th Edition,0134700656
A A E,421,Economic Decision Analysis,Introduction to Management Science,0134730660
ECON,330,Money and Banking,"The Economics of Money, Banking, and Financial Markets",0134733821
RP & SE,920,Reh Coun Ed-Cnslg Supervision,Fundamentals of Clinical Supervision,0134790282
CS&D,110,Intro to Communicative Dis,Introduction to Communication Disorders: A Lifespan Evidence-Based Perspective (6th edition),0134801476
FINANCE,325,Corporation Finance,Corporate Finance,0135161081
PUB AFFR,818,Intro Stat Meths-Pub Pol Anal,Stats: Data and Models,0135163825
ECON,442,Macroeconomic Policy,"Macroeconomics (Subscription),",0135179222
RP & SE,730,Professional Counseling Orient,"Ethical, Legal, and Professional Issues in Counseling, 6th edition",0135183816
CS&D,315,Phonetics and Phon. Dvlpt.,Fundamentals of Phonetics: A Practical Guide for Students,0135207871
ASTRON,200,The Physical Universe,"The Cosmic Perspective, 9th edition",0135729458
CBE,311,Thermodynamics of Mixtures,Introductory Chemical Engineering Thermodynamics,0136068549
CIV ENGR,395,Matrls-Constructed Facilities,Materials for Civil and Construction Engineers,0136110583
RP & SE,820,Clin Rehab Cnslg-Cnslg Theory,"Theories of Counseling and Psychotherapy: Systems, Strategies, and Skills",0136874874
E C E,330,Signals and Systems,Signals and Systems,0138147570
ENGL,822,Topics in Theory,Collected Fictions,0140286809
ENGL,242,Literature and Culture II,Disgrace,0140296402
AFROAMER,222,Intro-Black Women Writers,"Incidents in the Life of A Slave Girl, Written By Herself",0140437959
CLASSICS,100,Legacy of Greece & Rome,The Swaggering Soldier,0140441499
CLASSICS,100,Legacy of Greece & Rome,Phormio,0140443240
CLASSICS,100,Legacy of Greece & Rome,Agamemnon,0140443332
LITTRANS,209,Masterpieces-Fr Lit & Culture,Pierre and Jean,0140443585
CLASSICS,100,Legacy of Greece & Rome,Antigone,0140444254
FRENCH,804,Interdis W Europ Studies Sm,"Capital: A Critique of Political Economy, vol. 1",0140445688
CLASSICS,100,Legacy of Greece & Rome,Bacchae,0140447262
LITTRANS,220,Chekhov in Translation,Anton Chekhov: Plays,0140447330
CLASSICS,834,Roman Political Thought,"Sallust: Catiline's War, the Jugurthine War...",0140449488
CLASSICS,100,Legacy of Greece & Rome,Knights,0140449518
CLASSICS,100,Legacy of Greece & Rome,Electra,0140449785
CLASSICS,100,Legacy of Greece & Rome,The Brothers Menaechmus,0140449822
CLASSICS,100,Legacy of Greece & Rome,Suppliants,0140449990
ILS,371,Interdis in Arts & Humanities,Annals (Penguin Classics),0140455649
LITTRANS,235,The World of Sagas,Historical Atlas of the Vikings,0140513288
CLASSICS,100,Legacy of Greece & Rome,Comedy of Errors,0140714746
PHILOS,440,Existentialism,The Fall,0141187945
ENGL,178,"Digital Media, Lit, Culture",Frankenstein,0141439471
SLAVIC,245,Topics-Slavic Literatures,Homo zapiens,0142001813
AFROAMER,222,Intro-Black Women Writers,Passing,0142437278
LITTRANS,201,19&20th C Russn Lit Tran I,Anna Karenina,0143035008
HISTORY,600,Advanced Seminar in History,They Would Never Hurt a Fly: War Criminals on Trial in the Hague,0143035428
M H R,628,Negotiations,Bargaining for Advantage,0143036975
M H R,628,Negotiations,Beyond Reason: Using Emotions as You Negotiate,0143037781
ENGL,176,Topics in Literature and Film,The Haunting of Hill House,0143039983
LITTRANS,201,19&20th C Russn Lit Tran I,Crime and Punishment,0143107637
LSC,100,Science and Storytelling,The Poison Squad,0143111122
M H R,628,Negotiations,Getting to Yes: Negotiating Agreement Without Giving In,0143118756
REAL EST,720,Urban Economics,Triumph of the City,0143120544
AMER IND,437,American Indian Women,Holding Our World Together: Ojibwe Women and the Survival of Community,0143121596
ENGL,814,Topics in Contemporary Lit,A Tale for the Time Being,0143124870
ECON,460,Economic Forecasting,The Signal and the Noise,0143125082
COMP LIT,203,Intro Cross-Cultrl Lit Form,Frankenstein in Baghdad: A Novel,0143128793
CHICLA,330,Topics in Chicano/a Studies,The Flower in the Skull,0156006347
ENGL,242,Literature and Culture II,To the Lighthouse,0156907392
AFROAMER,712,Educ and Civil Rights Movement,"We Are an African People: Independent Education, Black Power, and the  Radical Imagination",0190055530
PHILOS,241,Introductory Ethics,A Concise Introduction to Ethics,0190058173
PHILOS,241,Introductory Ethics,The Ethical Life,0190058241
HISTORY,139,Middle East-20th Century,The Modern Middle East.,0190218867
ENVIR ST,120,Intro Earth System,Physical Geography,0190246860
SOC WORK,800,Field Prac/Integrat Smr III,School Social Work National Perspectives on Practice in Schools,0190273842
NURSING,741,Adv Prac Nrsg Thry-Famly&Child,Exploring Family Theories,0190297268
POLI SCI,411,The American Constitution I,"American Constitutionalism, Second Ed.: vol. I",0190299477
CBE,255,Intro to Chem Process Modeling,Getting Started with MATLAB: A Quick Introduction for Scientists and Engineers,0190602062
PUBLHLTH,780,Evidence-Based Decision-Making,Evidence-based Public Health,0190620936
L I S,619,Music Resrch Mthds & Matls,Music Research,0190644505
SOC WORK,800,Field Prac/Integrat Smr III,Just Practice,0190657079
MUSIC,751,Seminar in Piano Pedagogy,Teaching Piano Pedagogy: A Guidebook for Training Effective Teachers,0190670535
PHILOS,101,Introduction to Philosophy,Exploring Philosophy: An Introductory Anthology,0190674335
SPANISH,802,Smr-Spanish American Lit,Gender and Rock,0190688660
E C E,340,Electronic Circuits I,Microelectronic Circuits,0190853532
CBE,470,Process Dynamics & Control,"PROCESS DYNAMICS, MODELING & CONTROL",0195091199
LEGAL ST,645,Intellectual Freedom,Copyright's Paradox,0195137620
CLASSICS,110,The Ancient Mediterranean,The Ancient Mediterranean World,0195155631
CLASSICS,100,Legacy of Greece & Rome,Trojan Women,0195179101
E C E,536,Integrated Optics&Optoelect,Photonics,0195179460
AFROAMER,712,Educ and Civil Rights Movement,Silent Covenants: Brown v. Board of Education and the Unfulfilled Hopes of Racial Reform,0195182477
ELPA,863,Race Class & Ed Inequality,Despite the Best Intentions: How Racial Inequality Thrives in Good Schools,0195342727
CSCS,775,Building Civil Society,The Oxford Handbook of Civil Society,0195398571
F&W ECOL,110,Living with Wildlife,A Sand County Almanac and Sketches Here and There,0197500262
BIOCORE,485,Principles of Physiology,e-Textbook Bundle,0197556016
STAT,609,Mathematical Statistics I,Probability and Random Processes,0198572220
SOC,674,Demographic Techniques I,Demographic Methods and Concepts,0198752639
ENGL,414,Global Spread of English,Decolonization: A Very Short Introduction,0199340491
CHEM,714,Organometal-Transitn Elemts,Organometallic Chemistry,0199342679
SOC WORK,646,Child Abuse and Neglect,Broken Three Times:  a story of child abuse in America,0199399154
HISTORY,130,Intro to World History,Islamic History: A Very Short Introduction,0199545728
PHYSICS,406,Special Topics in Physics,"Relativity, Gravitation and Cosmology: A Basic Introduction",0199573646
B M I,541,Intro to Biostatistics,An Introduction to Medical Statistics,0199589920
MUSIC,623,Form and Analysis,Comedy: A Very Short Introduction,0199601714
CLASSICS,100,Legacy of Greece & Rome,Medea,0199602087
ENGL,350,Topics in Gender & Literature,A Case of Hysteria (Dora),0199639861
BOTANY,265,Rainforests and Coral Reefs,Coral Reefs:  A Very Short Introduction,0199682775
CLASSICS,100,Legacy of Greece & Rome,Lysistrata,0199797448
AFRICAN,204,Intro Topics African Languages,Articulate While Black: Barack Obama Language and Race in the US,0199812981
ASIAN,456,"Japan, US-Crisis in Asia","A Modern History of Japan from Tokugawa Times to the Present (Oxford, 2003)",0199930159
MUSIC,413,Survey Music-Baroque Era,Music of the Baroque,0199942015
HISTORY,201,The Historian's Craft,The Witchcraft Sourcebook,0203455548
SOC WORK,921,Child Welfare,Child Welfare and Family Services: Policies and Practice (8th Edition),0205571901
ILS,205,"W Cult:Pol,Econ&Soc Thght I",Nicomachean Ethics,0226026756
ENVIR ST,328,Environmental History: Europe,"The Light-Green Society: Ecology and Technological Modernity in France, 1960-2000.",0226044187
ELPA,911,Authentic Pedagogy and Achieve,Producing Success: The Culture of Personal Advancement in an American High School.,0226142418
LITTRANS,260,Italy & Invention of America,Marvelous Possessions: The Wonder of the New World,0226306520
ENGL,800,Critical Methods in Lit,Antigone,0226311517
ELPA,887,Diversity and Inequality,"The Diversity Bargain: And Other Dilemmas of Race, Admissions, and Meritocracy at Elite Universities",0226400143
L I S,619,Music Resrch Mthds & Matls,A Manual for Writers,0226430577
FRENCH,211,French Lit & Interdis Studies,Demons of the Night,0226432083
HIST SCI,720,Historiography & Methods,"The Structure of Scientific Revolutions, 4th edition",0226458120
AFRICAN,700,Reading&Writing Afri Cultr Std,Writing Your Journal Article in Twelve Weeks,0226499918
LAW,940,Law & Contemporary Problems,Inside the presidential debates : their improbable past and promising future,0226530413
ELPA,961,Critical Issues in Ed Policy,Suddenly Diverse How School Districts Manage Race,0226675367
POLI SCI,511,Campaign Finance,The Fallacy of Campaign Finance Reform,0226734507
ENGL,800,Critical Methods in Lit,Antigone's Claim,0231118958
ART HIST,500,Prosem:Spec Topics-Art Hist,Rasa: Performing the Divine in India,0231131452
ASIALANG,355,First Semester Asian Language,"A Primer for Advanced Beginners of Chinese, Simplified Character Version, Volume One",0231135672
ASIAN AM,240,Topics-Asian Amer Studies,Chop Suey USA  The Story of Chinese Food in America,0231168922
AFROAMER,712,Educ and Civil Rights Movement,The Freedom Schools: Student Activists in the Mississippi Civil Rights Movement,0231175692
ENGL,822,Topics in Theory,Media U.: How the Need to Win Audiences Has Shaped Higher Ed,0231186377
LSC,450,Photography for the Sciences,The Photographer's Eye - Composition and Design for Better Digital Photos,0240809342
COMP SCI,577,Introduction to Algorithms,Introduction to Algorithms,0262033848
HIST SCI,720,Historiography & Methods,Fascist Pigs: Technoscientific Organisms and the History of Fascism,0262536158
HISTORY,861,Seminar-History of Africa,Transient Workspaces: Technologies of Everyday Innovation in Zimbabwe,0262537582
ENGL,156,Literature and Medicine,The Bad Doctor: The Troubled Life and Times of Dr. Iwan James,0271067544
HISTORY,200,Historical Studies,Latinos and American Law: Landmark Supreme Court Cases,0292714113
CHICLA,330,Topics in Chicano/a Studies,"Forgetting the Alamo, Or, Blood Memory",0292721289
ENVIR ST,328,Environmental History: Europe,"The Rhine: An Eco-Biography, 1815-2000. University",0295985008
ASIAN AM,150,Lit & Culture of Asian America,America Is in the Heart,0295993539
ASIAN AM,150,Lit & Culture of Asian America,Citizen 13660,0295993546
BOTANY,455,The Vegetation of Wisconsin,Vegetation of Wisconsin,0299019402
FOLKLORE,200,Folklore Cent East North Eur,The Vampire: A Casebook,0299159245
GEN&WS,320,"Topics-Gender, Women & Society",Women and Gender in Islam,0300055832
ASIALANG,239,Third Semester Urdu,Let's Study Urdu: An Introductory Course,0300114003
ASIALANG,139,First Semester Urdu,Let's Study Urdu: An Introduction to the Script,0300120608
ITALIAN,311,Advanced Italian Language,Trame: a contemporary Italian reader,0300124958
GERMAN,337,Adv Compositn & Conversatn,"?	Schreiben lernen: A Writing Guide for Learners of German.",0300166033
POLI SCI,511,Campaign Finance,Plutocrats United,0300212457
A A E,246,Climate Change Econ & Policy,Climate Casino,0300212648
SPANISH,320,Spanish Phonetics,Sonidos en contexto,0300214437
HISTORY,861,Seminar-History of Africa,"Collecting Food, Cultivating People: Subsistence and Society in Central Africa",0300218534
POLI SCI,460,Topics in Political Philos,Liberty in the Things of God: The Christian Origins of Religious Freedom,0300226638
LITTRANS,209,Masterpieces-Fr Lit & Culture,Exile and the Kingdom,0307278586
AFROAMER,628,Hist-Civ Rghts Movmnt in US,At the Dark End of the Street,0307389244
ENGL,814,Topics in Contemporary Lit,Zone One,0307455178
ASIAN,274,Religion in South Asia,Nine Lives: In Search of the Sacred in Modern India,0307593597
CHICLA,330,Topics in Chicano/a Studies,The Buddha in the Attic,0307744425
CURRIC,704,Curriculum Planning,Discipline and punish: The birth of the prison,0307819291
ENGL,156,Literature and Medicine,The Death of Ivan Ilych,0307951335
ENGL,156,Literature and Medicine,Illness as Metaphor; AIDS and its Metaphors,0312420130
AFROAMER,154,Hip-Hop and Cont Am Society,Can't Stop Won't Stop: A History of the Hip-hop Generation,0312425791
LAW,802,Civil Procedure II,CIVIL PROCEDURE CASES AND MATERIALS,0314280169
LAW,723,Legal Research and Writing,"Impeccable Research, A Concise Guide to Mastering Legal Research Skills",0314282385
ENGL,400,Advanced Composition,Writing Tools: 55 Essential Strategies,0316014991
AFRICAN,203,Intro Topics in African Lit,Say You're One of Them,0316086363
ENGL,814,Topics in Contemporary Lit,How Long 'Til Black Future Month?,0316491372
COM ARTS,466,Writing for TV & Film,The Complete Screenwriter?s Manual: A Complete Reference of Format & Style,0321397935
MATH,322,Appl Mathematical Analysis,Applied Partial Differential Equations with Fourier Series and Boundary Value Problems,0321797056
L I S,751,Database Dsgn-Info Prof,Database Design for Mere Mortals: A hands-On Guide to Relational Database Design,0321884497
NURSING,434,Hlth & Ill Indiv Fam Cmty,Public Health Nursing,0323321532
NURSING,434,Hlth & Ill Indiv Fam Cmty,Medical-Surgical Nursing,0323328524
NURSING,434,Hlth & Ill Indiv Fam Cmty,Concepts for Nursing Practice,0323374736
COMP BIO,500,Fund Principles-Vet Anatomy,Guide to the Dissection of the Dog,0323391658
PHY THER,676,Musculoskeletal Dysfunction I,Clinical Orthopedic Rehabilitation,0323393706
NURSING,317,Pharmacology for Nrsg Practice,"Calculate with Confidence, 7th Edition",0323396837
NURSING,317,Pharmacology for Nrsg Practice,Pharmacology and the Nursing Process,0323529495
NURSING,434,Hlth & Ill Indiv Fam Cmty,Maternal Child Nursing Care,0323549387
PATH-BIO,510,Veterinary Immunology,Basic Immunology,0323549431
NURSING,323,Hlth & Ill Indiv Fam,Lewis's Medical Surgical Nursing,0323551496
NURSING,726,Foundations APN Clin Pract I,Primary Care:  Interprofessional Collaborative Practice,0323570152
NURSING,314,Hlth Promo Dz Prev Acrs Lfspn,Concepts for Nursing Practice,0323581936
PHY THER,635,Motor Control Dysfunction I,"UMPHRED?S NEUROLOGICAL REHABILITATION, SEVENTH EDITION                ISBN: 978-0-323-61117-6",0323611176
PHY THER,664,Clinical Medicine I,Primary Care for the Physical Therapist,0323638975
CURRIC,311,Language Acquisition and Use,Between worlds: Access to second language acquisition,0325030883
ELPA,911,Authentic Pedagogy and Achieve,Not this but that: No more teaching without positive relationships,9780325118
CNSR SCI,355,Financial Coaching,Coaching Skills: The Definitive Guide to Being A Coach,0335261925
ENGL,245,Seminar in the Major,Giovanni's Room,0345806567
NUTR SCI,631,Clinical Nutrition I,Nutrition Therapy and Pathophysiology,0357041710
ITALIAN,101,First Semester Italian,"Melucci/Tognozzi - Bundle: Piazza, Student Edition: Introductory Italian, Loose-Leaf Version, 2nd +",0357102237
ITALIAN,101,First Semester Italian,"Bundle: Piazza, Student Edition: Introductory Italian, 2nd + MindTap, 4 terms Printed Access Card",0357102251
CNSR SCI,627,Advanced Consumer Finance,Investments: An Introduction,0357127957
ECON,101,Principles-Microeconomics,Principles of Microeconomics,0357133484
ECON,101,Principles-Microeconomics,Principles of Microeconomics (loose-leaf text version with MindTap access code card),0357133712
ECON,310,Stats:Measrmnt in Economics,"Statistics for Management and Economics, Loose-leaf Version, 11th + MindTap",0357195673
LEGAL ST,131,Criminal Justice in America,Criminal Justice in America,0357251065
ECON,101,Principles-Microeconomics,Principles of Microeconomics,0357530443
ECON,101,Principles-Microeconomics,Principles of Microeconomics (MindTap access code card with eText),0357636619
ECON,102,Principles-Macroeconomics,"Mankiw - Custom MindTap for Economics, Principles of Macroeconomics",0357636640
PSYCH,510,Issues Child Psychopathology,Abnormal Child Psychology,0357692233
ENVIR ST,809,Intro-Energy Analysis & Policy,How Solar Energy Became Cheap: A Model for Low-Carbon Innovation,0367136598
STAT,240,Intro to Data Modeling I,Statistical Inference via Data Science,0367409821
ENGL,176,Topics in Literature and Film,Annihilation,0374104092
ENGL,156,Literature and Medicine,The Undying,0374279349
PSYCH,526,Criminal Mind:Forensics/Scienc,"The Wisdom of Psychopaths: What Saints, Spies, and Serial Killers Can Teach Us About Success",0374291358
ENGL,800,Critical Methods in Lit,S/Z,0374521677
ENGL,242,Literature and Culture II,Annie John,0374525101
ASIAN AM,240,Topics-Asian Amer Studies,A Lover's Discourse,0374532314
SLAVIC,245,Topics-Slavic Literatures,Day of the Oprichnik,0374533106
ENGL,178,"Digital Media, Lit, Culture",Dear Cyborgs,0374537111
ENGL,814,Topics in Contemporary Lit,Babel-17,0375706691
THEATRE,352,Auditioning for Stage & Screen,AUDITIONING,0375725371
CHICLA,330,Topics in Chicano/a Studies,Song of the Water Saints,0375725494
COMP LIT,350,Problms in Comp Lit & Cultures,Midaq Alley,0385264761
GERMAN,236,Bascom Course,The Strange Library,0385354318
AFROAMER,222,Intro-Black Women Writers,"Twilight: Los Angeles, 1992",0385473767
ECON,725,Machine Learning for Econ,Elements of Statistical Learning,0387216065
COMP SCI,726,Nonlinear Optimization I,Numerical Optimization,0387303031
ENGL,156,Literature and Medicine,Memoir of a Debulked Woman,0393073256
ANTHRO,860,Hist-Anthropological Theory,The Marx-Engels Reader,0393090406
MUSIC,211,Survey-Hist Western Music,Concise History of Western Music,0393124262
ECON,455,Behavioral Economics,The Undoing Project,0393254594
FOLKLORE,103,Intro-Mus Cult of the World,Soundscapes Exploring Music in a Changing World,0393264043
LITTRANS,222,Dostoevsky in Translation,Crime and Punishment,0393264272
ENGL,242,Literature and Culture II,Pride and Prejudice,0393264883
ENGL,731,Adv Theatre Hist-500bc-1700,"The Norton Anthology of Drama, Volume 1",0393283471
ENGL,120,Intro-Theatre & Dramatic Lit,"The Norton Anthology of Drama, Third Shorter Edition",0393283501
MUSIC,121,Musica Practica 1,A New Approach to Sightsinging (available at the UW Bookstore),0393284911
HISTORY,261,American Legal History to 1860,The Story of American Freedom,0393319620
CLASSICS,100,Legacy of Greece & Rome,The Bacchae of Euripides: A Communion Rite,0393325836
HISTORY,130,Intro to World History,A Brief History of the Human Race,0393326451
AFROAMER,151,Intro-Contemp Afro-Am Soc,Race in America,0393419504
PSYCH,202,Introduction to Psychology,Interactive Psychology: People in Perspective,0393421392
ECON,302,Intmed Macroeconomic Theory,Macroeconomics,0393422269
ENGL,120,Intro-Theatre & Dramatic Lit,The Little Seagull Handbook,0393602647
ENGL,241,Literature and Culture I,"Norton Anthology of English Literature, Volumes A, B, and C",0393603125
PSYCH,225,Research Methods,Research Methods in Psychology Third Edition,0393617542
POLI SCI,182,Politics Around World-Honors,Cases and Concepts in Comparative Politics: An Integrated Approach,0393631302
POLI SCI,120,Politics Around the World,Cases and Concepts in Comparative Politics,0393631364
HDFS,517,Couple Relationships,Intimate Relationships,0393640250
MUSIC,211,Survey-Hist Western Music,"Norton Anthology of Western Music, vol. 1, Ancient to Baroque",0393656411
MUSIC,101,The Musical Experience,The Enjoyment of Music - Shorter,0393664386
LSC,212,Intro-Scientific Communication,They Say / I Say: The Moves That Matter in Academic Writing,0393666076
ANTHRO,104,Cult Anthro&Human Diversity,Cultural Anthropology: A Toolkit for a Global Age,0393667929
POLI SCI,104,Intro-Amer Politcs&Governmt,American Government: Power and Purpose,0393674996
POLI SCI,311,United States Congress,The United States Congress,0393680195
ASTRON,104,Exploration of Solar System,"21 century astronomy, 6th edition",9780393691
JOURN,445,Creative Campaign Messages,Advertising: Concept and Copy,9780393733
POLI SCI,272,Intro to Public Policy,Policy Paradox,0393912722
ECON,475,Economics of Growth,Introduction to Economic Growth,0393919172
ECON,521,Game Theory & Economic Anal,Games of Strategy,0393919684
COMP LIT,203,Intro Cross-Cultrl Lit Form,The Metamorphosis,0393923209
LITTRANS,220,Chekhov in Translation,Anton Chekhov's Selected Stories,0393925302
LITTRANS,222,Dostoevsky in Translation,THE BROTHERS KARAMAZOV,0393926330
STAT,301,Intro-Statistical Methods,Statistics,0393929720
ASIAN,103,Intro-E Asian History:China,The Search for Modern China,0393934519
ENGL,431,Early Works of Shakespeare,The Norton Shakespeare: Early Plays and Poems,0393938579
SOC,125,Amer Soc: How It Really Works,Contemporary American Society: How it really works.,0393938852
ENGL,242,Literature and Culture II,Great Expectations,0393960693
ENGL,241,Literature and Culture I,Robinson Crusoe,0393964523
ENGL,242,Literature and Culture II,Strange Case of Dr Jekyll and Mr Hyde,0393974652
ENGL,242,Literature and Culture II,Short Novels,0393976410
ASIAN,456,"Japan, US-Crisis in Asia","Pacific War, 1931-45",0394734965
AFROAMER,222,Intro-Black Women Writers,The Street,0395901496
ENGL,577,Postcolonial Theatre,The Coup: A Play of Revolutionary Dreams,0413652607
THEATRE,250,Fundamentals of Acting,Stanislavski: The Basics,0415492973
ELPA,863,Race Class & Ed Inequality,Racial Formation in the United States,0415520317
ENGL,414,Global Spread of English,Global Englishes: A resource book for students,0415638449
HISTORY,600,Advanced Seminar in History,Pompeii and Herculaneum: A Sourcebook,0415666800
POLI SCI,401,Selected Topics-Poli Sci,Interviewing in Social Science Research: A Relational Approach,0415843744
ENGL,318,Second Language Acquisition,Second Language Acquisition: An Introductory Course,0415894951
ELPA,736,Admin Stdt Serv-Higher Educ,Linking Theory to Practice: Case Studies for Working with College Students,0415898706
